{
  "conformsTo": "aindf@0.2",
  "ds": {
    "id": "aindf-demo",
    "version": "0.1.0"
  },
  "sources": {
    "tokens": "tokens.json",
    "taxonomy": "taxonomy.json",
    "slots": "slots.json",
    "applicability": "applicability.json",
    "presets": "presets.json",
    "components": "components.json",
    "bindings": "bindings.json"
  },
  "implementation": {
    "framework": "next-app",
    "module": "@aindf-demo/ds"
  }
}
